{
    "context": {
            "ncbigene": "http://identifiers.org/ncbigene/"
        },
    "source_plan": 
    {
        "id_prefix":"ncbigene",
        "id_column": "Gene ID",
        "node_name_column": "Gene Symbol",
        "property_columns": [""]
    },
    "target_plan": 
    {

        "id_column": "Genomic Locus",
        "node_name_column": "CDS Mutation",
        "property_columns": ["Genomic Locus"]
    },
    "edge_plan": 
    {
        "default_predicate": "has mutation",
        "property_columns": ["Primary Tissue",
                             "Histology",
                             "Genomic Locus"]
    }
}